{
  "$schema": "http://json-schema.org/draft-07/schema#",
  "title": "Directive bundle-size budgets",
  "description": "Budgets enforced by scripts/size-check.ts. Each entry names a built entry file; the enforced number is that file plus every emitted file it imports, gzipped together.",
  "type": "object",
  "required": ["budgets"],
  "additionalProperties": false,
  "properties": {
    "$schema": { "type": "string" },
    "_README": {
      "type": "string",
      "description": "Why these numbers are what they are, for whoever has to raise one."
    },
    "_CONSUMERS_README": {
      "type": "string",
      "description": "Why the consumer-fixture numbers are what they are."
    },
    "consumers": {
      "type": "array",
      "description": "Consumer-fixture budgets enforced by scripts/size-consumer.ts: small real apps bundled for production, gzipped.",
      "items": {
        "type": "object",
        "required": ["fixture", "gzBudget"],
        "additionalProperties": false,
        "properties": {
          "fixture": {
            "type": "string",
            "description": "Path to a fixture app, relative to the repo root.",
            "pattern": "^scripts/size-fixtures/.+\\.ts$"
          },
          "gzBudget": {
            "type": "integer",
            "exclusiveMinimum": 0,
            "description": "Ceiling in bytes for the gzipped production bundle, at zlib's default level."
          },
          "forbidden": {
            "type": "array",
            "items": { "type": "string" },
            "description": "Dev-only text that must not appear in the production bundle."
          }
        }
      }
    },
    "budgets": {
      "type": "array",
      "minItems": 1,
      "items": {
        "type": "object",
        "required": ["path", "gzBudget"],
        "additionalProperties": false,
        "properties": {
          "path": {
            "type": "string",
            "description": "Path to a built entry file, relative to the repo root. Name the entry, never a chunk-*.js — chunk names are content-hashed and change on the next build that touches anything.",
            "pattern": "^packages/[^/]+/dist/.+\\.(js|cjs)$"
          },
          "gzBudget": {
            "type": "integer",
            "exclusiveMinimum": 0,
            "description": "Ceiling in bytes for the gzipped closure, at zlib's default level."
          }
        }
      }
    }
  }
}
